,,,Content,Word Choice & Style ,,,Organization,,,,Layout & Design,,,,ACTIONABILITY,,,,Medical Information,
URL,Title,Duration,"1. The material makes its purpose completely evident. (0,1)","3. The material uses common, everyday language. (0,1)","4. Medical terms are used only to familiarize audience with the terms. When used, medical terms are defined. (0,1) ","5. The material uses the active voice. (0,1)","8. The material breaks or “chunks” information into short sections (0,1,N/A)","9. The material’s sections have informative headers. (0,1,N/A)","10. The material presents information in a logical sequence. (0,1) ","11. The material provides a summary. (0,1,N/A)","13. Text on the screen is easy to read. (0,1,N/A) ","14. The material allows the user to hear the words clearly (e.g., not too fast, not garbled). (0,1,N/A)","18. The material uses illustrations and photographs that are clear and uncluttered. (0,1,N/A) ","19. The material uses simple tables with short and clear row and column headings. (0,1,N/A) ","20. The material clearly identifies at least one action the user can take. (0,1)","21. The material addresses the user directly when describing actions. (0,1)","22. The material breaks down any action into manageable, explicit steps. (0,1)","25. The material explains how to use the charts, graphs, tables, or diagrams to take actions. (0,1,N/A)",This video contain high medical knowledge (0: low; 1: High),
https://www.youtube.com/watch?v=sQ_BFNGg0CU,How Glitazones Work,60,1,0,0,0,N/A,N/A,1,N/A,N/A,1,N/A,N/A,0,0,0,N/A,1,
https://www.youtube.com/watch?v=yvVYwkV1Buo,What is Persistent Diarrhea?,60,1,1,1,1,N/A,N/A,1,N/A,N/A,1,N/A,N/A,1,1,0,N/A,0,
https://www.youtube.com/watch?v=t9o7jGViy4w,DPP4 inhibitors - Overview,61,1,0,0,0,0,0,1,0,N/A,1,N/A,N/A,1,1,0,N/A,0,
https://www.youtube.com/watch?v=kvQkyNOv4Rs,Health Update (Beta Mix) - Captain Novolin,61,0,1,1,0,0,0,0,0,N/A,1,N/A,N/A,0,0,0,N/A,0,
https://www.youtube.com/watch?v=DUlLEmobwys,Active Kids. Active Adults. - Physical Activity,61,1,1,1,1,0,0,1,0,N/A,1,N/A,N/A,1,1,0,N/A,0,
https://www.youtube.com/watch?v=0ttVVGfydkw,Heart Disease and Diabetes,61,1,1,1,1,0,0,1,0,N/A,1,N/A,N/A,1,1,0,N/A,1,
https://www.youtube.com/watch?v=xQHL1JVl3bc,Find a diabetes self-management education program in your area,61,1,1,1,1,0,0,1,0,N/A,1,N/A,N/A,1,1,0,N/A,0,
https://www.youtube.com/watch?v=Jk5IXhB9ZXM,Diabetes Rx May Do Double Duty for Parkinson‚Äôs Disease,63,1,1,1,1,0,0,1,0,N/A,1,N/A,N/A,0,0,0,N/A,1,
https://www.youtube.com/watch?v=Vb-nz6op8yg,BMI Calculator For Women And Men & What is BMI ?,65,1,1,1,1,0,0,1,0,N/A,1,1,N/A,0,0,0,N/A,1,
https://www.youtube.com/watch?v=kcuUcHU21Ik,Diabetes Basics: Hypoglycemia and Hyperglycemia,66,1,1,1,1,0,0,1,0,N/A,1,N/A,N/A,0,0,0,N/A,1,
https://www.youtube.com/watch?v=shsNVuFRKDo,Total Pancreatectomy with Autologous Islet Cell Transplant,66,1,0,0,0,0,0,1,0,N/A,1,N/A,N/A,0,0,0,N/A,0,
https://www.youtube.com/watch?v=HMe6iDvwFUw,The Connection Between Melatonin and Type 2 Diabetes,67,1,0,0,1,0,0,1,0,N/A,1,N/A,N/A,0,0,0,N/A,1,
https://www.youtube.com/watch?v=4JLnkpdjoU8,Type 1 Diabetes and Viral Infections,68,1,1,1,1,0,0,1,0,N/A,1,N/A,N/A,0,0,0,N/A,1,
https://www.youtube.com/watch?v=6IulrGavrjM,Diabetes Foot Care: Screening - Risk Factors,71,1,1,1,1,1,1,1,0,N/A,1,N/A,N/A,1,1,0,N/A,1,
https://www.youtube.com/watch?v=0ju0YMLt2sc,Glycosuria (Medical Symptom),71,1,1,1,0,0,0,0,0,1,N/A,N/A,N/A,0,0,0,N/A,0,
https://www.youtube.com/watch?v=2OFHQnz9vSg,How to avoid Frequent Urination,73,1,1,1,0,0,0,1,0,N/A,1,N/A,N/A,1,1,1,N/A,1,
https://www.youtube.com/watch?v=Y98ry3671Rg,What Is a Normal Blood Sugar Level,74,1,1,1,0,0,0,1,0,N/A,0,N/A,N/A,0,0,0,N/A,1,
https://www.youtube.com/watch?v=LI4AE9ys4eo,DPP4 Inhibitors is a Class of Medications that are Commonly Used to Treat Diabetes,74,1,1,1,1,1,1,1,0,N/A,1,N/A,N/A,0,0,0,N/A,1,
https://www.youtube.com/watch?v=87DX7150ovo,Popular Diabetes Rx May Have New Destination in the Body,74,1,1,1,1,0,0,1,0,N/A,1,N/A,N/A,0,0,0,N/A,1,
https://www.youtube.com/watch?v=M4BOOuJ2oiI,Polydipsia and Glycosuria (Medical Symptom),75,1,1,1,0,0,0,0,0,1,N/A,N/A,N/A,0,0,0,N/A,0,
https://www.youtube.com/watch?v=sCQmLYpXaYg,Coxiella burnetii-animated quick review,75,1,1,1,1,0,0,1,0,N/A,1,N/A,N/A,0,0,0,N/A,1,
https://www.youtube.com/watch?v=lshzaYhtOyA,Blurred vision and Glycosuria (Medical Symptom),76,1,1,1,0,0,0,0,0,1,N/A,N/A,N/A,0,0,0,N/A,0,
https://www.youtube.com/watch?v=80lIWoGHNNA,Angela Mack; RD; LD; CD; CDE - Diabetes and Metabolism,76,0,1,1,0,0,0,1,0,N/A,1,N/A,N/A,0,0,0,N/A,0,
https://www.youtube.com/watch?v=dCpHGtG9AZ8,Study identifies genes that drive type 2 diabetes,76,1,1,1,1,0,0,1,0,N/A,1,N/A,N/A,0,0,0,N/A,1,
https://www.youtube.com/watch?v=4uQrCTkPrFU,Female Sexual Dysfunction Causes,77,1,1,1,0,0,0,1,0,N/A,1,N/A,N/A,0,0,0,N/A,0,
https://www.youtube.com/watch?v=t1cZrBYbdYs,Diabetes (3/5): Oral Meds (Dirty Mnemonic) Pharmacology Insulin Resistance - Sulfonylurea; Biguanide,78,1,1,1,1,0,0,1,0,N/A,1,N/A,N/A,0,0,0,N/A,1,
https://www.youtube.com/watch?v=tGLEWEKHXFQ,Link between Diabetes & Heart Disease | Heart Disease,79,1,1,1,1,0,0,1,0,N/A,1,N/A,N/A,0,0,0,N/A,1,
https://www.youtube.com/watch?v=-s2qC5doR3s,Glycosuria and Polyuria (Medical Symptom),81,1,1,1,0,0,0,0,0,1,N/A,N/A,N/A,0,0,0,N/A,0,
https://www.youtube.com/watch?v=E3nTHnkZybk,Polydipsia; Blurred vision and Glycosuria (Medical Symptom),81,1,1,1,0,0,0,0,0,1,N/A,N/A,N/A,0,0,0,N/A,0,
https://www.youtube.com/watch?v=BZS0amkjOhI,Polyuria and Polyphagia (Medical Symptom),81,1,1,1,0,0,0,0,0,1,N/A,N/A,N/A,0,0,0,N/A,0,
https://www.youtube.com/watch?v=p1sEh1IUsKM,Fatigue and Glycosuria (Medical Symptom),82,1,1,1,0,0,0,0,0,1,N/A,N/A,N/A,0,0,0,N/A,0,
https://www.youtube.com/watch?v=imQ5qMqdoJM,FDA approves new diabetic insulin inhaler,82,1,1,1,1,0,0,1,0,N/A,1,N/A,N/A,0,0,0,N/A,1,
https://www.youtube.com/watch?v=-tbK80HA5fw,Polydipsia; Glycosuria and Polyphagia (Medical Symptom),83,1,1,1,0,0,0,0,0,1,N/A,N/A,N/A,0,0,0,N/A,0,
https://www.youtube.com/watch?v=MatiZeIGpb0,Weekend House Call: Acanthosis nigricans,84,1,1,1,1,0,0,0,0,N/A,1,N/A,N/A,1,1,0,N/A,1,
https://www.youtube.com/watch?v=odKDsbjKWps,TZD Takes Everyone,84,0,1,1,1,0,0,1,0,N/A,1,N/A,N/A,0,0,0,N/A,0,
https://www.youtube.com/watch?v=UOvWr-vMO94,Polydipsia; Polyuria and Polyphagia (Medical Symptom),85,1,1,1,0,0,0,0,0,1,N/A,N/A,N/A,0,0,0,N/A,0,
https://www.youtube.com/watch?v=-sWQnJ5dMSM,Polydipsia; Glycosuria and Polyuria (Medical Symptom),86,1,1,1,0,0,0,0,0,1,N/A,N/A,N/A,0,0,0,N/A,0,
https://www.youtube.com/watch?v=nxS-LP1StvE,Fatigue; Polydipsia and Glycosuria (Medical Symptom),86,1,1,1,0,0,0,0,0,1,N/A,N/A,N/A,0,0,0,N/A,0,
https://www.youtube.com/watch?v=OgpVYTnsmuk,Blurred vision; Glycosuria and Polyuria (Medical Symptom),87,1,1,1,0,0,0,0,0,1,N/A,N/A,N/A,0,0,0,N/A,0,
https://www.youtube.com/watch?v=ECG6sZiJ3Jc,Glycosuria; Polyuria and Polyphagia (Medical Symptom),89,1,1,1,0,0,0,0,0,1,N/A,N/A,N/A,0,0,0,N/A,0,
https://www.youtube.com/watch?v=nyRrm-cCj9g,some important side effects of canagliflozin,89,1,0,0,0,0,0,1,0,1,N/A,1,N/A,0,0,0,N/A,1,
https://www.youtube.com/watch?v=VXQ0aQHe9VQ,Insulin Secretion Beta Cell - Diabetes,90,1,0,0,0,0,0,1,0,1,N/A,1,N/A,0,0,0,N/A,1,
https://www.youtube.com/watch?v=pLrDuFCN3BI,Robin went off of all insulin and reduced eye pressure by 50% with Virta,90,1,1,1,1,0,0,1,0,N/A,1,N/A,N/A,0,0,0,N/A,0,
https://www.youtube.com/watch?v=0bRS-6GDLy4,Fatigue; Glycosuria and Polyuria (Medical Symptom),92,1,1,1,0,0,0,0,0,1,N/A,N/A,N/A,0,0,0,N/A,0,
https://www.youtube.com/watch?v=vfhreWZaLTs,Can Stem Cells Cure Blindness?,92,1,1,1,1,0,0,1,0,N/A,1,N/A,N/A,0,0,0,N/A,1,
https://www.youtube.com/watch?v=2N64oGaFQCA,Diabetes Medication,94,1,0,0,0,0,0,1,0,N/A,1,N/A,N/A,0,0,0,N/A,1,
https://www.youtube.com/watch?v=xmJ3zYQhUuo,Federal Employee: Type 2 Diabetes and Prediabetes Fast Facts: Risk Factors,95,1,1,1,0,1,1,1,0,1,N/A,1,N/A,1,1,1,N/A,1,
https://www.youtube.com/watch?v=QfE4CBG90tM,Type 2 Diabetes and Prediabetes Fast Facts: Risk Factors,95,1,1,1,0,1,1,1,0,1,N/A,1,N/A,1,1,1,N/A,1,
https://www.youtube.com/watch?v=AJ9QNdP9fHk,Fatigue; Polydipsia and Blurred vision (Medical Symptom),95,1,1,1,0,0,0,0,0,1,N/A,N/A,N/A,0,0,0,N/A,0,
https://www.youtube.com/watch?v=G11lr2N7gjQ,Do you know the risk factors for prediabetes and type 2 diabetes?,96,1,1,1,1,0,0,1,0,N/A,1,N/A,N/A,0,0,0,N/A,1,
https://www.youtube.com/watch?v=6lMJSzwffs4,Foods to Avoid after Bariatric Surgery | Obesity,97,1,1,1,1,0,0,1,0,N/A,1,N/A,N/A,1,1,0,N/A,1,
https://www.youtube.com/watch?v=yUZno6t4mTg,What Is Diabulimia? | Eating Disorders,97,1,1,1,1,0,0,1,0,N/A,1,N/A,N/A,1,1,0,N/A,1,
https://www.youtube.com/watch?v=_L2dpW_bFRc,Metabolic Syndrome and Plant-Based Diets,97,1,1,1,1,0,0,1,0,N/A,1,N/A,N/A,0,0,0,N/A,1,
https://www.youtube.com/watch?v=Bkvp1kKQLcE,Control Your Blood Sugar Levels for Diabetic Peoples,98,1,1,1,1,0,0,0,0,N/A,1,N/A,N/A,1,1,1,N/A,0,
https://www.youtube.com/watch?v=0Y4kAKn6bGc,Counting Carbohydrates Using a Food Label - Diabetes Center for Children at CHOP,98,1,1,1,1,0,0,1,0,N/A,1,1,N/A,1,1,1,1,1,
https://www.youtube.com/watch?v=Ika3dP47fAo,Home remedies for urinary tract infection or UTI (urine infection) without single penny,98,1,1,1,0,0,0,1,0,N/A,1,N/A,N/A,1,1,1,N/A,1,
https://www.youtube.com/watch?v=yP9OxQM1wls,Glycemic Index Table-Glycemic Index Food List-Glycemic Index Weight Loss-G.I. Index,100,1,1,1,0,0,0,1,0,1,N/A,N/A,N/A,0,0,0,N/A,1,
https://www.youtube.com/watch?v=PLPdAD15Ndg,What Causes Diabetic Foot Ulcers?,100,1,1,1,1,0,0,1,0,N/A,1,N/A,N/A,0,0,0,N/A,0,
https://www.youtube.com/watch?v=oCGgwc1Cb9A,Fatigue; Blurred vision and Polyuria (Medical Symptom),102,1,1,1,0,0,0,0,0,1,N/A,N/A,N/A,0,0,0,N/A,0,
https://www.youtube.com/watch?v=-J8UflGeY48,What Is Pancreatitis? | Stomach Problems,103,1,1,1,1,0,0,1,0,N/A,1,N/A,N/A,0,0,0,N/A,1,
https://www.youtube.com/watch?v=4CBIYoDF288,No more Insulin Injections? Encapsulated Pancreatic Cells offer possible new Diabetes Treatment.,103,1,0,0,0,0,0,1,0,1,0,1,N/A,0,0,0,N/A,1,
https://www.youtube.com/watch?v=drDU7X4kAf8,Joslin Scientists Advance Understanding of Human Brown Adipose Tissue and Grow New Cells,104,1,0,0,1,0,0,1,0,N/A,1,N/A,N/A,0,0,0,N/A,1,
https://www.youtube.com/watch?v=FnIf3OPDBFM,Willie reduced insulin down from 72 units of insulin per day to 0 on Virta,104,1,1,1,1,0,0,1,0,N/A,1,N/A,N/A,0,0,0,N/A,0,
https://www.youtube.com/watch?v=PuF0aJS_qaw,Osteoporosis | tzds and sulfonureas more fractures than metformin,104,1,0,0,1,0,0,1,0,0,1,0,N/A,0,0,0,N/A,1,
https://www.youtube.com/watch?v=V9FDxlZ_sik,First Aid Tips : How to Treat Insulin Shock,104,1,1,1,1,0,0,1,0,N/A,1,N/A,N/A,0,0,0,N/A,1,
https://www.youtube.com/watch?v=0phXsBQW48M,Smartphone app to cure blindness - Truthloader Investigates,105,1,1,1,1,0,0,1,0,N/A,1,N/A,N/A,0,0,0,N/A,1,
https://www.youtube.com/watch?v=LMvNeaUMRlw,Korean researchers develop nanopatch to monitor diabetes,105,1,0,0,1,0,0,1,0,1,1,1,N/A,0,0,0,N/A,1,
https://www.youtube.com/watch?v=OaxRva_GajU,Call Up the Glucagon - Glycogenolysis Rap,106,1,0,0,1,0,0,0,0,1,0,1,N/A,0,0,0,N/A,0,
https://www.youtube.com/watch?v=WGw-7Y0xEV0,SECOND OPINION | MEDICAL INNOVATIONS | ARTIFICIAL PANCREAS | BCBS,106,1,1,1,1,0,0,1,0,N/A,1,1,N/A,0,0,0,N/A,0,
https://www.youtube.com/watch?v=asTNBEltQQc,Clinical Psychologist: Katherine L. Applegate; PhD,106,1,1,0,1,0,0,1,0,N/A,1,N/A,N/A,0,0,0,N/A,0,
https://www.youtube.com/watch?v=Wd5Qmjt3egI,Diabetics Have Inhalable Insulin Option,106,1,1,1,1,0,0,1,0,N/A,1,N/A,N/A,0,0,0,N/A,1,
https://www.youtube.com/watch?v=QfRpnA3CKos,Amylin Pharmaceuticals Increases Speed to Insight with 100 Million Rows,110,1,1,0,1,0,0,1,0,N/A,1,N/A,N/A,0,0,0,N/A,0,
https://www.youtube.com/watch?v=sBx5OHKW2nM,Medicare & You: End stage renal disease/kidney transplant eligibility & enrollment,110,1,1,1,1,0,0,1,0,N/A,1,N/A,N/A,0,0,0,N/A,1,
https://www.youtube.com/watch?v=RABThDFW000,Chromium; the Amazing for Insulin Resistance,111,1,1,1,1,0,0,1,0,1,1,1,N/A,1,1,0,N/A,1,
https://www.youtube.com/watch?v=Lq2taGJseak,Auto Islet Transplantation and Other Treatment Options at Ohio State‚Äôs Pancreas Clinic,111,1,1,1,1,0,0,1,0,N/A,1,N/A,N/A,0,0,0,N/A,0,
https://www.youtube.com/watch?v=xuNEnhCZFLo,Tom's story (NHS Diabetes Prevention Programme),111,1,1,1,1,0,0,1,0,N/A,1,N/A,N/A,1,1,0,N/A,1,
https://www.youtube.com/watch?v=40UJSG_B5vA,Natural Tea For Control Diabetes | Why Drinking Tea May Help Prevent and Manage Type 2 Diabetes,112,1,1,1,1,0,0,1,0,N/A,1,N/A,N/A,1,1,1,N/A,1,
https://www.youtube.com/watch?v=8CBC8vf8K_s,How To Reverse Type 2 Diabetes - Diabetic Nephropathy,113,1,1,1,1,0,0,1,0,N/A,1,N/A,N/A,0,0,0,N/A,0,
https://www.youtube.com/watch?v=1Zsyast6s9Y,What Is a Sugar Glider? | Sugar Gliders,113,1,1,0,1,0,0,1,0,N/A,1,N/A,N/A,0,0,0,N/A,0,
https://www.youtube.com/watch?v=Yhn2qguQfUM,Polydipsia; Blurred vision and Polyuria (Medical Symptom),114,1,1,1,0,0,0,0,0,1,1,N/A,N/A,0,0,0,N/A,0,
https://www.youtube.com/watch?v=sQ-0RkPu35o,Animation: Detecting diabetic retinopathy through a dilated eye exam,114,1,0,0,1,0,0,1,0,1,1,1,N/A,0,0,0,N/A,1,
https://www.youtube.com/watch?v=rPmDXv-fBRQ,Troubleshooting high blood-glucose levels ‚Äì Miriam's personal story,115,1,1,1,1,0,0,1,0,N/A,1,N/A,N/A,0,0,0,N/A,1,
https://www.youtube.com/watch?v=GZdmuwRYNAs,Early Estimation of ESRD Risk,115,1,1,1,1,0,0,1,0,1,1,1,N/A,0,0,0,N/A,1,
https://www.youtube.com/watch?v=x93I3a30FEg,Design of a Noninvasive Glucose Monitor,116,1,1,0,1,0,0,1,0,N/A,1,N/A,N/A,0,0,0,N/A,0,
https://www.youtube.com/watch?v=ZCpSiSS0Yv4,Pancreatic Auto Islet Transplantation with Total Pancreatectomy,117,1,0,1,1,0,0,1,0,1,1,1,N/A,0,0,0,N/A,1,
https://www.youtube.com/watch?v=oIyXFT6YGBE,CANVAS,118,0,0,0,1,0,0,1,0,N/A,1,N/A,N/A,0,0,0,N/A,1,
https://www.youtube.com/watch?v=Q4p6Suko25A,Fatigue and Polydipsia (Medical Symptom),119,1,1,1,0,0,0,0,0,1,N/A,N/A,N/A,0,0,0,N/A,0,
https://www.youtube.com/watch?v=LedWl2QTy40,Is Meat Good For Diabetes || Diabetes Diet Plan,119,1,1,1,1,0,0,1,0,N/A,1,N/A,N/A,0,0,0,N/A,1,
https://www.youtube.com/watch?v=JHgUzLCWqvw,B cell activation,121,1,0,0,1,0,0,1,0,1,1,1,N/A,0,0,0,N/A,1,
https://www.youtube.com/watch?v=QMzNnvkYOF0,How to Test Your Blood Glucose Level | FreeStyle Precision Neo,122,1,1,1,1,0,0,1,0,1,1,1,N/A,1,1,1,N/A,1,
https://www.youtube.com/watch?v=ufCiGz75DAk,Biology: Cell Transport,123,1,0,1,1,0,0,1,0,1,1,1,N/A,0,0,0,N/A,1,
https://www.youtube.com/watch?v=DBXgnMfVFzI,Food and Your Blood Sugar -- Lantus and Novolog - Diabetes Center for Children at CHOP,123,1,1,1,1,0,0,1,0,1,1,1,N/A,0,0,0,N/A,1,
https://www.youtube.com/watch?v=7QL2CaJFn_k,Guide to - Prescribing intermediate and/or long-acting insulin,124,0,0,0,0,0,0,1,0,0,N/A,0,N/A,0,0,0,N/A,0,
https://www.youtube.com/watch?v=29KdXZH0niA,Glycemic Load vs. Glycemic Index,124,1,1,1,1,0,0,1,0,N/A,1,N/A,N/A,0,0,0,N/A,1,
https://www.youtube.com/watch?v=SA-sug6P0fM,Polydipsia and Polyuria (Medical Symptom),125,1,1,1,0,0,0,0,0,1,N/A,N/A,N/A,0,0,0,N/A,0,
https://www.youtube.com/watch?v=u3QmJbB9lvk,New target for diabetes therapies,125,1,0,0,1,0,0,1,0,N/A,1,N/A,N/A,0,0,0,N/A,1,
https://www.youtube.com/watch?v=nDxfxIaRfQ4,Purify Your Kidneys; Liver and Pancreas Using Only One Ingredient,126,1,1,1,1,0,0,1,0,1,1,N/A,N/A,1,1,1,N/A,1,
https://www.youtube.com/watch?v=nSwBbPUUduQ,GlySure‚Ñ¢ | Continuous Glucose Monitoring System - Marketing Film,126,1,1,0,1,0,0,1,0,1,1,1,N/A,0,0,0,N/A,0,
https://www.youtube.com/watch?v=jvg8EmtWF78,Which glucose meter is the best on the market?,127,1,1,1,1,0,0,1,0,N/A,1,N/A,N/A,0,0,0,N/A,0,
https://www.youtube.com/watch?v=m3xKf7bNQ0Q,Normal Blood Sugar For Children,127,1,1,1,0,0,0,1,1,1,1,N/A,N/A,1,0,0,N/A,1,
https://www.youtube.com/watch?v=wP3Bra09rcQ,How to Deal with Gestational Diabetes,128,1,1,1,1,0,0,1,0,N/A,1,N/A,N/A,1,1,0,N/A,1,
https://www.youtube.com/watch?v=Ef-NZtTVSMM,Hyperinsulinaemia and Disseminated Arterial Disease - Part 02,130,1,0,0,1,0,0,1,0,N/A,1,N/A,N/A,0,0,0,N/A,1,
https://www.youtube.com/watch?v=f4D5IgUYn3w,Preventing Infections When Monitoring Blood Glucose,130,1,1,1,1,0,0,1,0,N/A,1,N/A,N/A,1,0,0,N/A,1,
https://www.youtube.com/watch?v=Rg-ao84fnrw,Joyful condition;;;;  insulin in your blood;;;;;?,131,0,0,0,0,0,0,0,0,N/A,0,N/A,N/A,0,0,0,N/A,0,
https://www.youtube.com/watch?v=ScjyYj7UdsM,Dr. Max Gomez: Artificial Pancreas,132,1,1,1,1,0,0,1,0,N/A,1,N/A,N/A,0,0,0,N/A,1,
https://www.youtube.com/watch?v=nTQcW7frfSw,Inhaled Insulin Is Quick & Easy To Use; But Is It A Game-Changer?,132,1,1,1,1,0,0,1,0,N/A,1,N/A,N/A,0,0,0,N/A,1,
https://www.youtube.com/watch?v=usIZ0YSQFD0,antidiabetes drugs,132,1,0,0,1,0,0,1,0,N/A,1,N/A,N/A,0,0,0,N/A,0,
https://www.youtube.com/watch?v=aVWZDhk-DVU,Diabetes Medication,133,1,0,0,0,0,0,1,0,N/A,1,N/A,N/A,0,0,0,N/A,1,
https://www.youtube.com/watch?v=ItjPn8WxVSA,Pharmacokinetics: Vd; Clearance; Half-life: Calculation Drug Distribution; Elimination; Rate,135,1,0,0,0,0,0,1,0,1,1,N/A,N/A,0,0,0,N/A,1,
https://www.youtube.com/watch?v=Ex5_Z-DpJ0A,This Remedy Is The ‚ÄúBest‚Äù For Cholesterol; Diabetes; Infections and More...,136,1,1,1,1,0,0,1,0,1,1,N/A,N/A,1,1,1,N/A,1,
https://www.youtube.com/watch?v=J4AacdAkP08,I Woke Up With Acne!,136,1,1,1,1,0,0,1,0,N/A,1,1,N/A,0,0,0,N/A,0,
https://www.youtube.com/watch?v=IVz7xJxHOjk,Improving Glycemic Control in Diabetes,137,1,0,0,1,0,0,1,0,1,1,1,N/A,0,0,0,N/A,1,
https://www.youtube.com/watch?v=Grw7zvY9gY8,What Is Peripheral Vascular Disease? | Heart Disease,137,1,1,1,1,0,0,1,0,N/A,1,N/A,N/A,0,0,0,N/A,1,
https://www.youtube.com/watch?v=KtT7zvYJekA,Medication | diabetes medicines cause arthritis,138,1,1,1,1,0,0,1,0,N/A,1,N/A,N/A,0,0,0,N/A,1,
https://www.youtube.com/watch?v=jPrElTL3rrA,Cushing's Disease,138,1,1,1,1,0,0,1,0,N/A,1,N/A,N/A,0,0,0,N/A,0,
https://www.youtube.com/watch?v=QFc-5oXgbYY,Exercise Training Alters Subcutaneous White Adipose Tissue (scWAT),139,1,0,0,1,0,0,1,0,N/A,1,N/A,N/A,0,0,0,N/A,1,
https://www.youtube.com/watch?v=IkoC3HZwe7Q,Overweight World - Obesity Facts and Statistics,140,1,1,1,1,0,0,1,0,1,1,1,N/A,0,0,0,N/A,1,
https://www.youtube.com/watch?v=mco8vQPhFho,Glucosense  ends finger pricking for people with Diabetes,140,1,1,1,1,0,0,1,0,N/A,1,1,N/A,0,0,0,N/A,0,
https://www.youtube.com/watch?v=JNUmKulUWec,Richard M. and the YMCA Diabetes Prevention Program,140,1,1,1,1,0,0,1,0,N/A,1,N/A,N/A,0,0,0,N/A,0,
https://www.youtube.com/watch?v=49OlI6LmMDU,How To Improve $exual Drive For Diabetic Patient,141,1,1,1,1,0,0,1,0,1,1,1,N/A,1,1,1,N/A,0,
https://www.youtube.com/watch?v=HvcQdJcN6mk,Inhaled Insulin Offers Alternative For Needle Weary Diabetics,142,1,1,1,1,0,0,1,0,N/A,1,N/A,N/A,0,0,0,N/A,1,
https://www.youtube.com/watch?v=XeZgKLfIJn4,How  to Give Your Diabetic Cat an Insulin Injection,142,1,1,1,1,0,0,1,0,1,1,1,N/A,1,1,1,N/A,1,
https://www.youtube.com/watch?v=H-8wC490oEs,Polydipsia (Medical Symptom),144,1,1,1,0,0,0,0,0,1,N/A,N/A,N/A,0,0,0,N/A,0,
https://www.youtube.com/watch?v=oj0pjco--Yw,Polyuria (Medical Symptom),144,1,1,1,0,0,0,0,0,1,N/A,N/A,N/A,0,0,0,N/A,0,
https://www.youtube.com/watch?v=Wa7yYFPVb6o,Observational Study Finds Sanofi‚Äôs Diabetes Drug Lowers Incidence of Hypoglycemia,144,1,0,0,1,0,0,1,0,N/A,1,N/A,N/A,0,0,0,N/A,0,
https://www.youtube.com/watch?v=LCdTfQXDK34,Why is Tony Robbins so gigantic   Acromegaly - #FOTD265,144,1,1,1,1,0,0,1,0,N/A,1,N/A,N/A,0,0,0,N/A,1,
https://www.youtube.com/watch?v=8hnvY6_Jpvg,3 Simple Home Remedies To TREAT URINARY TRACT INFECTION (UTI) In Women,146,1,1,1,1,0,0,1,0,1,1,1,N/A,1,1,1,N/A,1,
https://www.youtube.com/watch?v=l_9vgXkmVnk,Glucose Test,147,1,1,1,1,0,0,1,0,N/A,1,N/A,N/A,0,0,0,N/A,1,
https://www.youtube.com/watch?v=3NRpp1pBN2E,Cara pemakaian insulin penggunaan insulin pen,148,1,1,1,0,0,0,1,0,N/A,1,0,N/A,1,1,1,N/A,0,
https://www.youtube.com/watch?v=K4SOS9okas4,Get to Know CDC‚Äôs National Diabetes Prevention Program,151,1,1,1,1,0,0,1,0,0,1,N/A,N/A,0,0,0,N/A,1,
https://www.youtube.com/watch?v=7Au-MRjoHYQ,What is the National Diabetes Prevention Program?,151,1,1,1,1,0,0,1,0,1,1,N/A,N/A,0,0,0,N/A,1,
https://www.youtube.com/watch?v=UeXD730uIII,On the Job with the National Diabetes Prevention Program,151,1,1,1,1,0,0,1,0,1,1,N/A,N/A,0,0,0,N/A,1,
https://www.youtube.com/watch?v=bhOF3Kx8CEQ,Reversing Prediabetes,151,1,1,1,1,0,0,1,0,1,1,N/A,N/A,1,1,0,N/A,1,
https://www.youtube.com/watch?v=99CLGZNuFqE,Diabetes Self-Management Education,151,1,1,1,1,0,0,1,0,N/A,1,N/A,N/A,0,0,0,N/A,1,
https://www.youtube.com/watch?v=auIwEV1SiBQ,Fragile X Syndrome,152,1,0,0,1,0,0,1,0,1,1,1,N/A,0,0,0,N/A,1,
https://www.youtube.com/watch?v=k22zlWRzbk0,Risk Factors For Diabetes and Diabetes Type 1 Risk Factors,153,1,1,1,0,0,0,1,0,1,0,N/A,N/A,0,0,0,N/A,0,
https://www.youtube.com/watch?v=QTKS0AUbEao,NetSure LifeScan IT Asset Management By Curvature,153,1,1,1,1,0,0,1,0,1,1,1,N/A,0,0,0,N/A,0,
https://www.youtube.com/watch?v=U3z9nMMklFw,How Turmeric tea cure Diabetics? | Here is the Evidence,154,1,1,1,1,0,0,1,0,N/A,1,1,N/A,1,1,1,N/A,0,
https://www.youtube.com/watch?v=mbD2oAjPU0c,How To Prepare an Insulin Syringe to Inject a Diabetic Cat,154,1,1,1,1,0,0,1,0,N/A,1,1,N/A,1,1,1,N/A,1,
https://www.youtube.com/watch?v=7VQfOt_2XG4,Statins & Cholesterol: CoQ10 Lowers Side Effects (& diabetes; hyperglycemia risks),155,1,1,1,1,0,0,1,0,1,1,1,N/A,0,0,0,N/A,0,
https://www.youtube.com/watch?v=WjyQTmJBXFg,What is Metabolic Syndrome?,155,1,1,1,1,0,0,1,0,1,1,1,N/A,0,0,0,N/A,1,
https://www.youtube.com/watch?v=Uk6U9ROn_MU,Invokana Amputation Lawsuits: Contact the F & A Diabetes Drug Injury Lawyers,155,1,1,1,1,0,0,1,0,N/A,1,N/A,N/A,0,0,0,N/A,0,
https://www.youtube.com/watch?v=1C2WpZA_L4E,I Shit My Pants,155,1,1,1,1,0,0,1,0,N/A,0,N/A,N/A,0,0,0,N/A,0,
https://www.youtube.com/watch?v=JJoyWK58CvY,Physical Activity in Schools,156,1,1,1,1,0,0,1,0,N/A,1,1,N/A,0,0,0,N/A,0,
https://www.youtube.com/watch?v=kDF2-ScA5gw,Tell Me a Story: Teen Who Feels No Pain Counts Her Blessings,156,1,1,1,1,0,0,1,0,N/A,1,N/A,N/A,0,0,0,N/A,0,
https://www.youtube.com/watch?v=rDoCCS-fBls,5 Things that increase women's sexual desire,156,1,1,1,1,0,0,1,0,1,1,N/A,N/A,1,1,1,N/A,0,
https://www.youtube.com/watch?v=JqJaVvLO748,Signs & Symptoms of Diabetes,157,1,1,1,1,0,0,1,0,1,1,N/A,N/A,1,1,0,N/A,1,
https://www.youtube.com/watch?v=DghH1bas9SQ,Amino Diet - How Does it Work?,158,1,1,0,1,0,0,1,0,1,1,N/A,N/A,0,0,0,N/A,0,
https://www.youtube.com/watch?v=povArl9xZSg,Basal/Bolus insulin and Carbohydrates,159,1,0,0,0,0,0,1,0,1,1,1,N/A,0,0,0,N/A,1,
https://www.youtube.com/watch?v=Sev0xmmU6LI,Endocrinology - Polyuria: By Jeannette Goguen M.D.,160,1,1,1,1,0,0,1,0,1,1,1,N/A,1,1,1,N/A,1,
https://www.youtube.com/watch?v=_f-KFSSzzlk,Diabetes And Glucose? | Diabetes And High Blood Glucose | Control Your Blood Sugar Levels Naturally,161,1,1,1,1,0,0,1,0,1,1,1,N/A,0,0,0,N/A,1,
https://www.youtube.com/watch?v=iUK-odLKD-k,Diabetes Foot Care: Screening - Vascular,161,1,1,1,1,0,0,1,0,1,1,1,N/A,1,1,1,N/A,1,
https://www.youtube.com/watch?v=CJu37EU9qEk,Intro to Bodyweight Fitness,162,1,1,1,1,0,0,1,0,N/A,1,1,N/A,0,0,0,N/A,0,
https://www.youtube.com/watch?v=zLbAxztnnfE,Low Thyroid Function and Diabetes,163,1,0,0,0,0,0,1,0,1,1,1,N/A,0,0,0,N/A,0,
https://www.youtube.com/watch?v=f6HtqolhKqo,Blood pressure measurement - OSCE guide,163,1,1,1,1,0,0,1,0,1,1,1,N/A,0,0,0,N/A,1,
https://www.youtube.com/watch?v=e8c5AZFKsJ4,Dipeptidyl peptidase-4 inhibitor,164,1,0,0,0,0,0,1,0,N/A,1,N/A,N/A,0,0,0,N/A,1,
https://www.youtube.com/watch?v=EO-tN64_IvY,5 Yoga Poses For DIABETES | Lower Blood Sugar Levels,166,1,1,1,1,0,0,1,0,N/A,1,1,N/A,1,1,1,N/A,1,
https://www.youtube.com/watch?v=wH6aT1GzY6w,How to Drink Baking Soda; The Natural Remedy  | Drinking Baking Soda For Health,166,1,1,1,1,0,0,1,0,N/A,1,1,N/A,1,1,1,N/A,1,
https://www.youtube.com/watch?v=dPomv-2PEeo,I CAN'T BELIEVE IT WORKS - Natural Trick For Diabetes Control || BOILED EGG,167,1,1,1,1,0,0,1,0,N/A,1,1,N/A,1,1,1,N/A,0,
https://www.youtube.com/watch?v=_P7nLJWuvks,Only 30 Days Your Blood Sugar Levels Will be Normal | Diabetes Diet,168,1,1,1,1,0,0,1,0,N/A,1,1,N/A,1,1,1,N/A,0,
https://www.youtube.com/watch?v=3R6gfAa2w8w,Impaired glucose tolerance,169,1,0,0,0,0,0,1,0,N/A,1,N/A,N/A,0,0,0,N/A,1,
https://www.youtube.com/watch?v=fIsuxH01R90,Home Remedies for Diabetes Kill Diabetes Forever In Just 8 Days Easy And Faster,169,1,1,1,1,0,0,1,0,N/A,1,1,N/A,1,1,1,N/A,0,
https://www.youtube.com/watch?v=UTuF58aK5po,Guide to - Prescribing short-acting insulin,170,1,0,0,0,0,0,1,0,0,1,0,N/A,0,0,0,N/A,0,
https://www.youtube.com/watch?v=zsVRO4IZoFw,NO MEDICINE NECESSARY FOR DIABETES - Cure Diabetes,171,1,1,1,1,0,0,1,0,N/A,1,1,N/A,1,1,1,N/A,0,
https://www.youtube.com/watch?v=tG0ck_xE07M,I Was Never Skinny Enough,174,1,1,1,1,0,0,1,0,N/A,1,1,N/A,0,0,0,N/A,1,
https://www.youtube.com/watch?v=mLmKq5bQOg0,Myocardial Infarction and Coronary Angioplasty Treatment; Animation.,174,1,0,0,1,0,0,1,0,N/A,1,1,N/A,0,0,0,N/A,1,
https://www.youtube.com/watch?v=ayuVb9-nFVo,IGF-1 as One-Stop Cancer Shop,176,1,0,0,1,0,0,1,0,1,1,1,N/A,0,0,0,N/A,1,
https://www.youtube.com/watch?v=dKYxRDO2G_0,Living With Diabetes and Without Junk Food,176,1,1,1,1,0,0,1,0,N/A,1,1,N/A,1,0,0,N/A,1,
https://www.youtube.com/watch?v=1EEJ1Hm66mg,Turmeric Curcumin for Prediabetes,176,1,1,1,1,0,0,1,0,1,1,1,N/A,1,1,0,N/A,1,
https://www.youtube.com/watch?v=VJgnv314808,Postprandial glucose test,178,1,0,0,0,0,0,1,0,N/A,1,N/A,N/A,0,0,0,N/A,1,
https://www.youtube.com/watch?v=wvMoHXD3agg,IRIS: Pioglitazone Reduced the Risk of Recurrent Stroke and MI for Study Patients,178,1,0,0,1,0,0,1,0,N/A,1,N/A,N/A,0,0,0,N/A,1,
https://www.youtube.com/watch?v=YICvHsKmjzY,Group and Team Activities - Lifelong Physical Activity,178,1,1,1,1,0,0,1,0,N/A,1,N/A,N/A,0,0,0,N/A,0,
https://www.youtube.com/watch?v=p0VF1FjLt-U,URINE ANALYSIS: Presence of PROTEIN in urine,179,1,0,0,0,0,0,0,0,1,N/A,1,N/A,0,0,0,N/A,0,
