,,,Content,Word Choice & Style ,,,Organization,,,,Layout & Design,,,,ACTIONABILITY,,,,Medical Information,
https://www.youtube.com/watch?v=18japm2PugI,Pre-Diabetes and Diabetes: Prevention; Screening and Risk Factors,181,1,1,1,1,0,0,1,0,N/A,1,N/A,N/A,1,1,0,N/A,1,
https://www.youtube.com/watch?v=nMoJ7TZN7l8,Diabetes and migraines an unlikely combination - #FOTD336,182,1,1,1,1,0,0,1,0,1,1,1,N/A,0,0,0,N/A,1,
https://www.youtube.com/watch?v=EipqFlmxCkM,Do I Have Hypoglycemia or Hyperglycemia?,183,1,1,1,1,0,0,1,0,N/A,1,N/A,N/A,0,0,0,N/A,0,
https://www.youtube.com/watch?v=nJfB32MtqBA,Hepatic lobule | Gastrointestinal system physiology | NCLEX-RN | Khan Academy,185,1,0,0,1,0,0,1,0,1,1,1,N/A,0,0,0,N/A,1,
https://www.youtube.com/watch?v=wbShOXhO6p8,Heart Attack Due to Atherosclerosis,185,1,0,0,0,0,0,1,0,N/A,1,1,N/A,0,0,0,N/A,1,
https://www.youtube.com/watch?v=-eg-MHdoJ_Q,Detection of Sugar in Urine - MeitY OLabs,188,1,0,0,0,0,0,1,1,1,1,1,N/A,1,0,1,N/A,1,
https://www.youtube.com/watch?v=IVH_6ciQfZk,Endocrinology - Hirsutism and Hypertrichosis: By Joshua Lakoff M.D.,191,1,1,1,1,0,0,1,0,1,1,1,N/A,0,0,0,N/A,0,
https://www.youtube.com/watch?v=a58oCExOxpw,YMCA Diabetes Prevention Program:  ‚ÄúIt Will Truly Change Your Life.‚Äù,191,1,1,1,1,0,0,1,0,N/A,1,N/A,N/A,0,0,0,N/A,0,
https://www.youtube.com/watch?v=GDlPAQakzo4,Heighten Your Senses By Simulating Blindness!,191,1,1,1,1,0,0,1,0,N/A,1,N/A,N/A,0,0,0,N/A,0,
https://www.youtube.com/watch?v=KReNoBISy3A,Where to Begin - Teaching ABE Students with Vision Loss and Blindness,191,1,1,1,1,0,0,1,0,N/A,1,N/A,N/A,0,0,0,N/A,0,
https://www.youtube.com/watch?v=cmUXo4Crrm0,How to Inject Insulin,192,1,1,1,1,0,0,1,0,N/A,1,1,N/A,1,1,1,N/A,1,
https://www.youtube.com/watch?v=numUKaH34rQ,My Eating Disorder Story,193,1,1,1,1,0,0,1,0,N/A,1,N/A,N/A,0,0,0,N/A,1,
https://www.youtube.com/watch?v=TBv3xQUGsXA,Healthy Diabetes Diet Tips,194,1,1,1,1,0,0,1,0,0,1,N/A,N/A,1,1,0,N/A,0,
https://www.youtube.com/watch?v=pD7YdUdEHdw,Diabetes Type 2 - Medication - Metformin; Glimepiride; Rosiglitazone & Insulin,195,1,0,0,1,0,0,1,0,N/A,1,N/A,N/A,0,0,0,N/A,1,
https://www.youtube.com/watch?v=HGuGIM54pK4,IF YOU STILL SUFFER FROM DIABETES AND HEART DISEASE TRY THESE -  NATURAL CURE FOR DIABETES,196,1,1,1,0,0,0,1,0,1,1,1,N/A,1,1,1,N/A,0,
https://www.youtube.com/watch?v=EAuf42kd8Aw,Did I Bleach My Skin? | Part 1,199,1,1,1,1,0,0,1,0,N/A,1,N/A,N/A,0,0,0,N/A,0,
https://www.youtube.com/watch?v=hfLn2N8KepM,Islet Transplant,199,1,0,0,1,0,0,1,0,N/A,1,N/A,N/A,0,0,0,N/A,0,
https://www.youtube.com/watch?v=52sEiZzYP0I,New Device Helping Diabetics Track Blood Sugar Without Fingersticks,200,1,1,1,1,0,0,1,0,N/A,1,N/A,N/A,0,0,0,N/A,0,
https://www.youtube.com/watch?v=8dgoeYPoE-0,What does the pancreas do? - Emma Bryce,201,1,1,1,1,0,0,1,0,1,1,1,N/A,0,0,0,N/A,1,
https://www.youtube.com/watch?v=nmWtsPzd-GQ,#24.4 Diagnosing Diabetes in Older Adults: Diabetes (4 of 6),201,1,1,1,1,0,0,1,0,N/A,1,N/A,N/A,1,1,0,N/A,1,
https://www.youtube.com/watch?v=kBQEuP5V-Pk,Myocardial Infarction Definition and Symptoms,203,1,1,1,1,0,0,1,0,N/A,1,N/A,N/A,0,0,0,N/A,1,
https://www.youtube.com/watch?v=nSuBzZR6llY,Acanthosis Nigricans [DermTV.com Epi #452],204,1,1,1,1,0,0,1,0,N/A,1,N/A,N/A,0,0,0,N/A,1,
https://www.youtube.com/watch?v=87TCC0iWB3Q,5 Early Symptoms of Diabetes |  Diabetes Skin Problems | What Causes Diabetes |  Skin Care Routine,205,1,1,1,1,0,0,1,0,1,1,1,N/A,0,0,0,N/A,1,
https://www.youtube.com/watch?v=xlxVZhjfo6s,Mike's Prediabetes Journey | Type 2 Diabetes Prevention | Ad Council,206,1,1,1,1,0,0,1,0,N/A,1,N/A,N/A,0,0,0,N/A,0,
https://www.youtube.com/watch?v=Lv4r-P6H7bU,Normal Blood Glucose Levels - What Should YOURS Be?,208,1,1,1,1,0,0,1,0,N/A,1,N/A,N/A,0,0,0,N/A,0,
https://www.youtube.com/watch?v=AssXudMGZ8A,Does The Glycemic Index Matter For Bodybuilding & Fat Loss?,208,1,1,1,1,0,0,1,0,N/A,1,N/A,N/A,1,1,0,N/A,1,
https://www.youtube.com/watch?v=OMn8Tq5Eyao,The Importance of Intensity in Physical Activity,208,1,1,1,1,0,0,1,0,1,1,1,N/A,0,0,0,N/A,1,
https://www.youtube.com/watch?v=tTM1oaEWoEc,NCLEX Question Review - NPH Insulin,209,1,0,0,0,0,0,1,0,1,1,N/A,N/A,0,0,0,N/A,1,
https://www.youtube.com/watch?v=a4gT5s-SXSc,Glycogenolysis,210,1,0,0,0,0,0,1,0,N/A,1,1,N/A,0,0,0,N/A,1,
https://www.youtube.com/watch?v=YtrM9STzEjo,AVOID DIABETES - 8 Easy Ways To Prevent Diabetes || Free Diabetes,210,1,1,1,1,0,0,1,0,N/A,0,N/A,N/A,1,0,1,N/A,0,
https://www.youtube.com/watch?v=IMPzAdVOhKY,Casey‚Äôs Acromegaly Story: Living with Acromegaly as a Chronic Condition,210,1,1,1,1,0,0,1,0,N/A,1,N/A,N/A,0,0,0,N/A,0,
https://www.youtube.com/watch?v=t32eoUB42rw,Are Artificial Sweeteners REALLY Safe?,211,1,1,1,1,0,0,1,0,N/A,1,N/A,N/A,0,0,0,N/A,1,
https://www.youtube.com/watch?v=KJDNHjJgbD8,Hypoglycemia; hyperglycemia; blood sugar levels,212,1,1,1,1,0,0,1,0,1,1,1,N/A,0,0,0,N/A,1,
https://www.youtube.com/watch?v=_1uqL32ASRE,Signs and Symptms of Hyperglycemia (High Blood Sugar),214,1,1,1,1,0,0,1,0,N/A,0,N/A,N/A,1,1,0,N/A,0,
https://www.youtube.com/watch?v=_JfEDVR5er0,Is Exercise Good For Diabetes,214,1,1,1,1,0,0,1,0,1,1,1,N/A,1,0,0,N/A,1,
https://www.youtube.com/watch?v=NwBzGfKY_gE,What is diabetic ketoacidosis (DKA)? - DiaBiteSize,215,1,1,1,1,0,0,1,0,N/A,1,1,N/A,1,1,0,N/A,1,
https://www.youtube.com/watch?v=RQCq-FzeYgA,4 Powerful Herbs to Boost Your Sex Drive | Natures Libido Booster,217,1,1,1,1,0,0,1,0,1,1,1,N/A,1,1,1,N/A,1,
https://www.youtube.com/watch?v=fUkKK1BvPvg,2 Investigators: The Black Market For Diabetes Test Strips,219,1,1,1,1,0,0,1,0,N/A,1,N/A,N/A,0,0,0,N/A,0,
https://www.youtube.com/watch?v=S09YWIykt2Y,Urinary Tract Infections in Children (UTIs),220,1,1,1,1,0,0,1,0,N/A,1,N/A,N/A,0,0,0,N/A,1,
https://www.youtube.com/watch?v=sRxqRU6CCJA,Cure For Diabetes - Is the Pancreatic Islet Transplantation a Feasible Cure For Diabetes,222,1,1,1,0,0,0,1,0,N/A,1,N/A,N/A,0,0,0,N/A,1,
https://www.youtube.com/watch?v=_9hPFlSnnNk,Polydipsia,223,1,0,0,0,0,0,1,0,N/A,1,N/A,N/A,0,0,0,N/A,1,
https://www.youtube.com/watch?v=XK0r8kINlTw,Take 2 Spoons Daily Kill Diabetes Permanently,225,1,1,1,1,0,0,1,0,N/A,1,1,N/A,1,1,1,N/A,1,
https://www.youtube.com/watch?v=i90i0YXq5aA,Function of the Pancreas & Pancreatic Disorders - Kambiz Kosari; MD,225,1,1,1,1,0,0,1,0,N/A,1,1,N/A,0,0,0,N/A,1,
https://www.youtube.com/watch?v=9mp8YkNqbBE,How To Lower Blood Pressure Quickly - Quick Natural Way To Lower Your BP,225,1,1,1,1,0,0,1,0,N/A,1,1,N/A,1,1,1,N/A,0,
https://www.youtube.com/watch?v=XfyGv-xwjlI,Diabetes Type 1 and Type 2; Animation.,226,1,1,1,0,0,0,1,0,1,1,1,N/A,0,0,0,N/A,1,
https://www.youtube.com/watch?v=qvhHhDNjtxM,Beginner Body Weight Circuit Workout | Nerd Fitness,226,1,1,1,1,0,0,1,0,N/A,1,N/A,N/A,1,1,1,N/A,0,
https://www.youtube.com/watch?v=9A3gDnv56bs,Quickly Bring Down My Blood Glucose #DiabetesCareClub,228,1,1,1,1,0,0,1,0,N/A,1,1,N/A,1,1,1,N/A,1,
https://www.youtube.com/watch?v=Pdec8clsV7Q,A Harmless Artificial Sweetener,228,1,1,1,0,0,0,1,0,1,1,1,N/A,0,0,0,N/A,1,
https://www.youtube.com/watch?v=B6jI_B8ExIs,Eat These 9 Foods To Prevent Strokes; Heart Attacks & Diabetes!,228,1,1,1,1,0,0,1,0,N/A,1,1,N/A,1,1,0,N/A,1,
https://www.youtube.com/watch?v=qG3OyONVbEQ,Risk Factors for Heart Disease: Diabetes,232,1,1,1,1,0,0,1,0,1,1,1,N/A,1,1,0,N/A,1,
https://www.youtube.com/watch?v=MMwdz1kLsFU,Treating Painful Diabetic Wounds and Ulcers,232,1,1,1,1,0,0,1,0,N/A,1,1,N/A,0,0,0,N/A,1,
https://www.youtube.com/watch?v=sT5SmIM60zo,Wearable Artificial Kidney (WAK) may replace Dialysis for Patients with End-Stage Renal Disease,233,1,0,0,0,0,0,1,0,1,0,1,N/A,0,0,0,N/A,0,
https://www.youtube.com/watch?v=VLOKMjHEyhY,Calisthenics Explained - Are Bodyweight Exercises Good For Building Muscle?,235,1,1,1,1,0,0,1,0,1,1,1,N/A,1,1,0,N/A,1,
https://www.youtube.com/watch?v=St9r4pc2QmE,Diagnosing and Treating Autonomic Disorder at Stanford - Marc Laderriere's story,237,1,1,1,1,0,0,1,0,N/A,1,N/A,N/A,0,0,0,N/A,0,
https://www.youtube.com/watch?v=32F2hQTncQ0,Tingling Feet and Hands: An Early Warning of Neuropathy,237,1,1,1,0,0,0,1,0,N/A,1,N/A,N/A,0,0,0,N/A,1,
https://www.youtube.com/watch?v=Z67NI1jq230,Blood Calcium Regulation,238,1,1,1,0,0,0,1,0,1,1,1,N/A,0,0,0,N/A,1,
https://www.youtube.com/watch?v=9ccIlIId_R0,Living Boldly With Blindness - David Toro,238,1,1,1,1,0,0,1,0,N/A,1,N/A,N/A,0,0,0,N/A,0,
https://www.youtube.com/watch?v=9IaRuSxJO-8,My Metabolic Syndrome,238,1,1,1,1,0,0,1,0,N/A,1,N/A,N/A,0,0,0,N/A,1,
https://www.youtube.com/watch?v=w7Nq9uQJOXE,Chronic Pancreatitis,239,1,0,0,1,0,0,1,0,1,1,1,N/A,0,0,0,N/A,1,
https://www.youtube.com/watch?v=UtLtPgYc0mk,Are Artificial Sweeteners Unhealthy? (Effects of Aspartame),240,1,1,1,1,0,0,1,0,1,1,1,N/A,0,0,0,N/A,1,
https://www.youtube.com/watch?v=-y6NkP_VaAQ,5 Must-Know Facts about PCOS,242,1,1,1,1,0,0,1,0,1,1,1,N/A,0,0,0,N/A,1,
https://www.youtube.com/watch?v=JkgXZ5EPwDA,Living Healthy:  Clinical Trials for Lung cancer,243,1,0,0,1,0,0,1,0,N/A,1,N/A,N/A,0,0,0,N/A,1,
https://www.youtube.com/watch?v=hhWGKAcHbO8,Diabetic Foot Ulcer Pictures; Treatment and Symptoms,243,1,1,1,0,0,0,1,0,N/A,1,1,N/A,0,0,0,N/A,0,
https://www.youtube.com/watch?v=froHNJMELT0,Increase Your Physical Activity,244,1,1,1,1,0,0,1,0,N/A,1,N/A,N/A,1,1,1,N/A,1,
https://www.youtube.com/watch?v=-IaysvX1L8U,Medical School - Diagnosing Diabetes,246,1,1,1,1,0,0,1,0,1,1,N/A,N/A,0,0,0,N/A,1,
https://www.youtube.com/watch?v=eawWLRnX_gc,Diabetes Emergency - Glucagon Kit Demonstration,247,1,1,1,1,0,0,1,0,N/A,1,1,N/A,1,1,1,N/A,1,
https://www.youtube.com/watch?v=J1TorkgpgY0,Do I Need Diabetes Medication,247,1,1,1,1,0,0,1,0,1,1,1,N/A,1,0,0,N/A,1,
https://www.youtube.com/watch?v=hv0bBW_Ah0Y,Diabetes Prevention Program,247,1,1,1,1,0,0,1,0,1,1,N/A,N/A,0,0,0,N/A,1,
https://www.youtube.com/watch?v=gGeLxjgUNG4,Could a blind eye regenerate? - David Davila,247,1,1,1,1,0,0,1,0,1,1,1,N/A,0,0,0,N/A,1,
https://www.youtube.com/watch?v=vhF1aEOaIzw,Is Cranberry Juice Good for You?,247,1,1,1,1,0,0,1,0,N/A,1,N/A,N/A,1,1,0,N/A,1,
https://www.youtube.com/watch?v=Ows34T0UjsM,DIABETES TIPS AND TRICKS: MAKE YOUR DEXCOM SENSOR LAST LONGER!,248,1,1,1,1,0,0,1,0,N/A,1,N/A,N/A,1,1,1,N/A,1,
https://www.youtube.com/watch?v=HRTKfRXwBTg,Plant-Based Diets for Diabetes,249,1,1,1,1,0,0,1,0,1,1,1,N/A,1,1,0,N/A,1,
https://www.youtube.com/watch?v=X_e8bXcS1BA,Best Blood Test Strip Reviews 2017 ‚Äì How to Choose the Best Blood Test Strip,252,1,1,1,1,0,0,1,0,1,1,1,N/A,0,0,0,N/A,0,
https://www.youtube.com/watch?v=qYBou4o9vNI,Histology of the Pancreas: Endocrine and Exocrine,253,1,0,0,0,0,0,1,1,1,1,1,N/A,0,0,0,N/A,1,
https://www.youtube.com/watch?v=JMknA_CCnW4,Discharge: Subcutaneous Injection; Patient Education  PostCare‚Ñ¢ Recovery Video,259,1,1,1,1,0,0,1,0,1,1,1,N/A,1,1,1,N/A,1,
https://www.youtube.com/watch?v=cZdh9Xa3lhU,Hemoglobina glicosilada; glucosilada o glicada (HbA1c) y diabetes,261,1,0,0,1,0,0,1,0,1,1,1,N/A,0,0,0,N/A,1,
https://www.youtube.com/watch?v=Gfr364SyQcg,What Kind of Tea is Good for Diabetes?,262,1,1,1,1,0,0,1,0,1,1,N/A,N/A,0,0,0,N/A,1,
https://www.youtube.com/watch?v=910K7B_1b6I,Hypoglycemia - Causes; Symptoms And Treatment,262,1,1,1,0,0,0,1,0,1,0,N/A,N/A,1,1,0,N/A,1,
https://www.youtube.com/watch?v=Aoy3ZCZwbeo,Does Everyone With Prediabetes Eventually Get Diabetes?,262,1,1,1,1,0,0,1,0,1,1,N/A,N/A,0,0,0,N/A,1,
https://www.youtube.com/watch?v=MsGmoVknaZQ,Alpha-glucosidase inhibitor,263,1,0,0,0,0,0,1,0,N/A,0,N/A,N/A,0,0,0,N/A,1,
https://www.youtube.com/watch?v=bbqOggZHtaM,How to Prevent Prediabetes from Turning into Diabetes,263,1,1,1,1,0,0,1,0,1,1,1,N/A,1,1,0,N/A,1,
https://www.youtube.com/watch?v=hkrK-vg7KD4,Endocrinology ‚Äì Hypoglycemia: By Robyn Houlden M.D.,263,1,1,1,0,0,0,1,0,1,1,1,N/A,0,0,0,N/A,1,
https://www.youtube.com/watch?v=mjnseqLiVXM,Bodyweight Back Workout (NO PULLUP BAR!),266,1,1,1,1,0,0,1,0,N/A,1,1,N/A,1,1,1,N/A,0,
https://www.youtube.com/watch?v=TJ7EagZKN5w,8 Things That Happen In Your Body If You Only Drink Water For A Month,266,1,1,1,0,0,0,1,0,1,0,N/A,N/A,0,0,0,N/A,1,
https://www.youtube.com/watch?v=jwD7bJrYH6U,Recurrent Urinary Tract Infections (UTIs): Here's What You Need to Know,266,1,1,1,1,0,0,1,0,1,1,N/A,N/A,1,1,0,N/A,1,
https://www.youtube.com/watch?v=imZwSsB6eGo,Great Indian Medicine For Diabetes,267,1,1,1,0,0,0,1,0,N/A,1,1,N/A,1,1,1,N/A,1,
https://www.youtube.com/watch?v=ayd0yO-yNZ4,Exercise and Type 2 Diabetes Prevention - (New) Timing & P.A.C.E.,267,1,1,1,0,0,0,1,0,1,1,N/A,N/A,1,1,0,N/A,1,
https://www.youtube.com/watch?v=1WrdzNJ4A44,Detection of Sugar in Urine - MeitY OLabs,268,1,0,0,0,0,0,1,0,N/A,0,1,N/A,0,0,0,N/A,0,
https://www.youtube.com/watch?v=L77b57erQ4M,The 10's Beginner Workout (Body Weight Only),272,1,1,1,1,0,0,1,0,N/A,1,N/A,N/A,1,1,0,N/A,0,
https://www.youtube.com/watch?v=Ab9OZsDECZw,How blood pressure works - Wilfred Manzano,272,1,1,1,1,0,0,1,0,1,1,1,N/A,0,0,0,N/A,1,
https://www.youtube.com/watch?v=geO2L3fzF5g,AHA/ADA Scientific Statement: Type 1 Diabetes Mellitus and Cardiovascular Disease,272,1,1,1,1,0,0,1,0,N/A,1,N/A,N/A,0,0,0,N/A,1,
https://www.youtube.com/watch?v=QSXWXPWUWEc,Diabetes Frequently Asked and Question - Part 2,273,1,1,1,0,0,0,1,0,1,1,1,N/A,1,1,1,N/A,1,
https://www.youtube.com/watch?v=596LMJTJFsk,Diabetes Medication,273,1,0,0,0,0,0,1,0,N/A,1,N/A,N/A,0,0,0,N/A,1,
https://www.youtube.com/watch?v=2Uw0sFgkeqY,Human Physiology - Proximal Convoluted Tubule: Reabsorption of Na; Glucose; Amino Acids and Chloride,275,1,0,0,1,0,0,1,0,1,1,1,N/A,0,0,0,N/A,1,
https://www.youtube.com/watch?v=F8UGIKR3okA,Primary polydipsia,275,1,0,0,0,0,0,1,0,N/A,0,N/A,N/A,0,0,0,N/A,1,
https://www.youtube.com/watch?v=Op8K7yresDs,How to Use an Insulin Pen | Inject Insulin Pen,276,1,1,1,0,1,1,1,0,1,1,1,N/A,1,1,1,N/A,1,
https://www.youtube.com/watch?v=dpNpHXB52ak,Sitagliptin,278,1,0,0,0,0,0,1,0,N/A,1,N/A,N/A,0,0,0,N/A,1,
https://www.youtube.com/watch?v=xchGJ4UxCPE,Is Prediabetes The Same Thing As Impaired Glucose Tolerance Or Impaired Fasting Glucose?,279,1,1,1,1,0,0,1,0,1,1,1,N/A,0,0,0,N/A,1,
https://www.youtube.com/watch?v=eOhz3cGmlaw,How to Lower Your Blood Pressure Naturally,282,1,1,1,1,0,0,1,0,N/A,1,N/A,N/A,1,1,0,N/A,1,
https://www.youtube.com/watch?v=FkkK5lTmBYQ,Insulin Signaling (Signal Pathways),283,1,0,0,1,0,0,1,0,1,1,1,N/A,0,0,0,N/A,1,
https://www.youtube.com/watch?v=nTyL81Ls3ys,PreDiabetes Risk Factors and Type 2 Diabetes Risk Factors Pre diabetes,283,1,1,1,0,0,0,1,0,N/A,0,N/A,N/A,0,0,0,N/A,1,
https://www.youtube.com/watch?v=lEutFrar1dI,Physical Activity Guidelines -- Introduction,283,1,1,1,1,0,0,1,0,N/A,1,N/A,N/A,1,1,1,N/A,1,
https://www.youtube.com/watch?v=wCN-6ZiTmu0,Extreme Anorexic Returns from Rehab,284,,,,,,,,,,,,,,,,,,
https://www.youtube.com/watch?v=74s6eiBBBFU,What Causes Hypoglycemia?,284,1,1,1,1,0,0,1,0,1,1,1,N/A,0,0,0,N/A,1,
https://www.youtube.com/watch?v=RycF0ub2Al0,Hormone concentration metabolism and negative feedback | NCLEX-RN | Khan Academy,287,1,0,0,1,0,0,1,0,1,1,1,N/A,0,0,0,N/A,1,
https://www.youtube.com/watch?v=_KndwmMEwXA,Impaired fasting glucose,287,1,1,1,0,0,0,1,0,N/A,0,N/A,N/A,1,0,0,N/A,1,
https://www.youtube.com/watch?v=e_oUWPdb9xM,What Are The Risk Factors For Getting Prediabetes?,287,1,1,1,1,0,0,1,0,1,1,N/A,N/A,0,0,0,N/A,1,
https://www.youtube.com/watch?v=LvaVsnHbIbI,#1 Diet Tip for Hypoglycemia (Low Blood Sugar),287,1,1,1,1,0,0,1,0,1,1,1,N/A,1,1,1,N/A,1,
https://www.youtube.com/watch?v=ISn43u0BiEo,Risk factors for diabetes Type 1 and type 2 ‚ö´healthcare‚òëÔ_è,288,1,1,1,0,0,0,1,0,N/A,0,1,N/A,0,0,0,N/A,1,
https://www.youtube.com/watch?v=AoHvkrcr6EM,How to Prevent Blood Sugar and Triglyceride Spikes after Meals,288,1,1,1,1,0,0,1,0,1,1,1,N/A,1,1,0,N/A,1,
https://www.youtube.com/watch?v=Usnu2ySuhcU,Traci's Acromegaly Story: How to Return to a Life of Normalcy,289,1,1,1,1,0,0,1,0,N/A,1,N/A,N/A,0,0,0,N/A,0,
https://www.youtube.com/watch?v=WYa2xthIbDc,Insulin Resistance? What Is It And How We Can Heal,291,1,1,1,1,0,0,1,0,1,0,1,N/A,1,1,0,N/A,1,
https://www.youtube.com/watch?v=9iMGFqMmUFs,What would happen if you didn‚Äôt drink water? - Mia Nacamulli,292,1,1,1,1,0,0,1,0,N/A,1,N/A,N/A,0,0,0,N/A,1,
https://www.youtube.com/watch?v=7-cGz2eLyb4,PostCare‚Ñ¢ Diabetes Center: Injecting Insulin,294,1,1,1,1,0,0,1,0,N/A,1,1,N/A,1,1,1,N/A,1,
https://www.youtube.com/watch?v=oozg7j3qpEY,INSULIN PUMPS ON THE BEACH IN MEXICO // travel with me T1D,294,1,1,1,1,0,0,1,0,N/A,1,N/A,N/A,1,1,1,N/A,1,
https://www.youtube.com/watch?v=CM1u29BeqC0,Lead: The Original Artificial Sweetener,294,1,1,1,1,0,0,1,0,N/A,1,N/A,N/A,0,0,0,N/A,1,
https://www.youtube.com/watch?v=Aw8hufhIDu0,What Causes Insulin Resistance?,296,1,1,1,1,0,0,1,0,1,1,1,N/A,0,0,0,N/A,1,
https://www.youtube.com/watch?v=BFUis11qaQU,10 Early Warning Signs Your Estrogen Levels Are Too High & How To Fix It,296,1,1,1,1,1,0,1,0,N/A,1,N/A,N/A,1,1,1,N/A,1,
https://www.youtube.com/watch?v=8nEmsR68FhA,Bodyweight Exercise Technique for Mass! (INTERMITTENT ISOMETRICS),297,1,1,1,1,0,0,1,0,N/A,1,1,N/A,1,1,1,N/A,0,
https://www.youtube.com/watch?v=341CnFGQwH4,Symptoms of Prediabete: How Do I Know I Have Prediabetes?,297,1,1,1,1,0,0,1,0,1,1,N/A,N/A,0,0,0,N/A,1,
https://www.youtube.com/watch?v=1p1cMFscF8s,Hypokalemia: Causes; Symptoms; Effects on the Heart; Pathophysiology; Animation.,299,1,1,1,0,0,0,1,0,1,1,1,N/A,0,0,0,N/A,1,
https://www.youtube.com/watch?v=z_3S2_41_FE,What BMI doesn't tell you about your health,300,1,1,1,1,0,0,1,0,1,1,1,N/A,0,0,0,N/A,1,
https://www.youtube.com/watch?v=53WxEvd7-_w,Polycystic Ovary Syndrome Treatments | Getting Pregnant with PCOS,301,1,1,1,1,1,0,1,0,1,1,1,N/A,1,1,1,N/A,1,
https://www.youtube.com/watch?v=iGK0rHkOoVA,How to Start Calisthenics - Beginner Bodyweight Workout Examples,306,1,1,1,1,1,1,1,0,1,1,1,N/A,1,1,1,N/A,1,
https://www.youtube.com/watch?v=s3wUYhJmdbA,Put Down the Diet Soda! The Dangers of Artificial Sweeteners-Transformation TV-Episode #005,307,1,1,1,1,0,0,1,0,N/A,1,N/A,N/A,0,0,0,N/A,1,
https://www.youtube.com/watch?v=-32U9eU1hdM,Hyperkalemia: Causes; Effects on the Heart; Pathophysiology; Treatment; Animation.,310,1,1,1,0,0,0,1,0,1,1,1,N/A,0,0,0,N/A,1,
https://www.youtube.com/watch?v=RV_lBWGgK1o,Why Is It Important To Know If A Person Has Prediabetes?,310,1,1,1,1,0,0,1,0,1,1,N/A,N/A,0,0,0,N/A,1,
https://www.youtube.com/watch?v=-y5VJLFEDfE,Can Vinegar Help with Blood Sugar Control ?|Dr Michael Greger,310,1,1,1,1,0,0,1,1,0,1,1,N/A,0,0,0,N/A,1,
https://www.youtube.com/watch?v=-vNVG7XJpVE,What is obesity? - Mia Nacamulli,311,1,1,1,1,0,0,1,0,N/A,1,1,N/A,0,0,0,N/A,1,
https://www.youtube.com/watch?v=Oyy-3yAwcvo,Jim‚Äôs Acromegaly Story: Riding the Acromegaly Rollercoaster,311,1,1,1,1,0,0,1,0,N/A,1,N/A,N/A,0,0,0,N/A,0,
https://www.youtube.com/watch?v=BF7N0LPdItk,Effects of Early Life Experience on Diabetes Risk: Genetics/Epigenetics,312,1,1,1,1,1,1,1,0,1,1,1,N/A,0,0,0,N/A,1,
https://www.youtube.com/watch?v=VAweyqtb7D8,Lipotoxicity: How Saturated Fat Raises Blood Sugar,312,1,1,1,1,0,0,1,0,N/A,1,1,N/A,0,0,0,N/A,1,
https://www.youtube.com/watch?v=L-a-dKhuYj8,Should Women With High Testosterone Be Allowed To Compete In Sports?,314,1,1,1,1,0,0,1,0,N/A,1,N/A,N/A,0,0,0,N/A,0,
https://www.youtube.com/watch?v=pgUA4ScsRWQ,Artificial Sweeteners - Safe or Dangerous?,314,1,1,1,1,0,0,1,0,N/A,1,1,N/A,1,0,1,N/A,1,
https://www.youtube.com/watch?v=fRZduVxlP_U,What Causes Insulin Resistance?,315,1,1,0,1,0,0,1,0,N/A,1,1,N/A,0,0,0,N/A,1,
https://www.youtube.com/watch?v=qFFPcIcAUUs,Sports Gender Controversy - Bonus Scene | Gender Revolution,315,1,1,1,1,0,0,1,0,N/A,1,N/A,N/A,0,0,0,N/A,0,
https://www.youtube.com/watch?v=Bkji1VNnolA,Making Beta Cells,317,1,1,1,1,0,0,1,0,N/A,1,1,N/A,0,0,0,N/A,1,
https://www.youtube.com/watch?v=wbWL2wfvsM8,Electrochemical gradients and secondary active transport | Khan Academy,317,1,0,0,1,0,0,1,0,1,1,1,N/A,0,0,0,N/A,1,
https://www.youtube.com/watch?v=It6Eblem5Zg,Can Vinegar Help with Blood Sugar Control?,317,1,0,1,0,0,0,0,0,0,0,0,0,1,0,0,1,4,
https://www.youtube.com/watch?v=uia5mqvTeh4,Lose Some Weight,317,0,1,0,0,0,0,0,1,1,1,1,0,1,0,1,0,7,
https://www.youtube.com/watch?v=MdXWF-vvQMc,ŸÜŸÇÿßÿ®ÿ© ÿßŸÑÿµŸäÿßÿØŸÑÿ© ÿßŸÑŸÖÿµÿ±Ÿäÿ© ÿ™ÿ_ÿßŸÑÿ® ÿ®ÿ_ÿ_ÿ® ÿ£ÿØŸàŸäÿ© ÿßŸÑÿ®ÿßŸäŸàÿ¨ŸÑŸäÿ™ÿßÿ_ŸàŸÜ pioglitazone|Health Online,317,0,0,0,0,0,0,0,0,0,0,0,0,0,0,0,0,0,
https://www.youtube.com/watch?v=X2rOWkOcq9I,(CC) Antihyperlipidemics Atorvastatin vs Fenofibrate vs Nicotinic Acid vs Colesevelam (Ch 6 Cardio),318,0,0,0,0,0,0,1,0,0,1,0,0,0,0,0,0,2,
https://www.youtube.com/watch?v=afYCN3Upy_w,Acute Coronary Syndrome and Heart Attack,318,1,1,1,1,0,0,1,1,1,1,1,0,1,1,0,1,12,
https://www.youtube.com/watch?v=VXFRWFHx6tA,Acute pyelonephritis (urinary tract infection) - causes; symptoms & pathology,318,1,1,1,1,0,0,1,1,1,1,1,1,1,1,1,1,14,
https://www.youtube.com/watch?v=2YVVfWIoHkw,Is Prediabetes The Same Thing As Metabolic Syndrome Or Syndrome X?,321,1,1,1,1,0,0,1,1,1,1,1,0,1,1,0,1,12,
https://www.youtube.com/watch?v=MFmjLloYN7A,Potassium & Blood Pressure: MUST WATCH!,322,1,1,1,1,0,0,1,1,1,1,0,0,1,1,1,1,12,
https://www.youtube.com/watch?v=InH8t0UNs4k,Best Glucose Meter For Type 2 Diabetes?,324,0,1,0,0,0,0,0,1,1,1,0,0,1,1,0,0,6,
https://www.youtube.com/watch?v=W_evi9lanBY,Acromegaly,325,1,1,1,0,1,1,1,1,1,1,0,0,1,1,0,1,12,
https://www.youtube.com/watch?v=Mj0T_byeKtQ,Insulin Synthesis and Secretion,326,1,0,1,0,1,1,1,1,1,0,0,0,1,1,1,1,11,
https://www.youtube.com/watch?v=orqdxsg-Dr4,Can Diabetic Retinopathy Be Reversed?,326,1,0,0,1,0,0,1,1,0,0,0,0,1,1,0,1,7,
https://www.youtube.com/watch?v=mRVZ9lkubag,A Change for Life,328,0,1,0,1,0,0,0,1,1,1,1,0,1,1,0,1,9,
https://www.youtube.com/watch?v=HOwqo56BKQU,What Is Postprandial Blood Glucose?,329,0,1,1,0,0,0,1,1,1,1,0,1,1,1,0,1,10,
https://www.youtube.com/watch?v=WBjchfwi1jA,Curing Painful Diabetic Neuropathy,330,1,0,1,1,0,0,1,1,0,0,0,0,1,1,0,1,8,
https://www.youtube.com/watch?v=tpPGevlDwWQ,Natural Treat To Cure Diabetes Without Medicine,331,0,1,0,0,0,1,1,1,1,1,1,0,1,1,1,0,10,
https://www.youtube.com/watch?v=fHui_Q6ld10,Ellie‚Äôs Acromegaly Story: Managing Breakthrough Symptoms,331,1,1,0,1,0,0,1,1,0,1,N/A,N/A,1,1,0,N/A,8,
https://www.youtube.com/watch?v=6t4tBmbPko8,Why is Meat a Risk Factor for Diabetes?,332,1,0,1,1,0,0,1,1,0,0,0,1,1,1,0,1,9,
https://www.youtube.com/watch?v=8ZujKJYrEJY,Natural PCOS Treatment Options - Polycystic Ovary Syndrome,334,1,1,1,1,0,0,1,1,1,1,1,1,1,1,1,1,14,
https://www.youtube.com/watch?v=cW1V2_GTAlc,Females with Fragile X Syndrome,339,0,1,0,1,0,0,0,1,1,1,1,0,1,1,0,0,8,
https://www.youtube.com/watch?v=T9wPrmfQ0vw,Hypoglycemia and Adrenal Fatigue - Lab tests don't tell all,340,0,0,0,0,0,0,1,1,N/A,0,N/A,N/A,1,1,0,N/A,4,
https://www.youtube.com/watch?v=xJBqbv8GRZ4,Free Weights vs Bodyweight Exercise,341,0,1,0,1,0,0,1,1,1,1,0,0,1,1,0,N/A,8,
https://www.youtube.com/watch?v=wjIp17OaN_k,Facial Mask for Hirsuitism,344,0,1,1,1,0,0,0,1,1,0,1,0,1,1,0,1,9,
https://www.youtube.com/watch?v=BzP4b1b-RPs,Weight-Loss Foods for Diabetes ‚Äî The BROAD Study,345,1,1,1,1,1,1,1,1,1,1,0,1,1,1,0,1,14,
https://www.youtube.com/watch?v=ux-A-WUMTjY,Diabetes Self-Management Education: Getting the Patient and Practice Perspective,345,0,1,0,1,0,0,0,1,1,1,0,0,1,1,0,N/A,7,
https://www.youtube.com/watch?v=DyGIvs9zrVA,Estimation of Blood Glucose by Glucose Oxidase Method - Amrita University,346,1,0,1,1,1,1,1,1,1,1,1,1,1,1,1,1,15,
https://www.youtube.com/watch?v=prFYht1NwmU,Insulin Administration - Registered Nurse Training,348,1,1,0,1,0,0,1,1,0,1,1,0,1,1,1,1,11,
https://www.youtube.com/watch?v=bBZXkNbpOGQ,How to Inject Insulin Using a Syringe | Nucleus Health,350,1,1,0,1,1,1,1,1,1,1,1,0,1,1,1,1,14,
https://www.youtube.com/watch?v=RudR2_VVoaw,Alcohol-related liver disease - causes; symptoms & pathology,351,1,1,0,1,0,0,1,1,1,1,1,0,1,1,1,1,12,
https://www.youtube.com/watch?v=wch09JVlXKg,Obesity Is Ridiculously Deadly,356,0,1,0,1,0,0,0,1,1,0,0,1,1,1,0,0,7,
https://www.youtube.com/watch?v=jDYm0i5zT68,How to Overcome High Blood Pressure Naturally,356,0,1,0,1,0,0,1,1,N/A,1,0,0,1,1,0,N/A,7,
https://www.youtube.com/watch?v=L1qDCZsqxxc,DANGEROUS FOODS FOR DIABETIC PATIENTS || Health Tips,358,0,1,0,1,1,1,0,1,1,1,1,0,1,1,0,1,11,
https://www.youtube.com/watch?v=sLn6OoH12uY,Top 5 Ways to Relieve Peripheral Neuropathy Foot Pain & Other Foot Ailments - Ask Doctor Jo,358,0,1,0,1,0,0,0,1,N/A,1,1,0,1,1,0,1,8,
https://www.youtube.com/watch?v=S-3nfpc_GiQ,How Do I Quickly Bring Down My Blood Glucose (Lower High Blood Sugar),359,0,1,0,1,0,0,1,1,1,1,0,0,1,1,0,0,8,
https://www.youtube.com/watch?v=aC0_yOlfY4U,Autoimmune hepatitis - causes; symptoms; diagnosis; treatment & pathology,360,1,0,0,1,1,1,1,1,,,,,,,,,6,
https://www.youtube.com/watch?v=5SZCajunA-0,Why Do Young; Slim People Get Diabetes Type 2,362,0,1,0,0,0,0,0,1,N/A,0,0,0,0,0,0,0,2,
https://www.youtube.com/watch?v=KWBjfoioS20,Can the Galaxy S9 Save Lives?,362,0,1,0,1,0,0,0,1,N/A,0,0,0,1,1,0,0,5,
https://www.youtube.com/watch?v=lOeQLJCVOdM,What is A Normal Blood Glucose?,365,0,1,0,1,0,0,1,1,N/A,0,0,0,1,1,0,N/A,6,
https://www.youtube.com/watch?v=weZZT8U9NGQ,Partner Addition (Classroom Physical Activity Breaks),366,0,1,0,1,0,0,1,1,N/A,0,0,0,1,1,0,N/A,6,
https://www.youtube.com/watch?v=US5aP7qT36M,Early Warning Signs of Pancreatic Cancer,368,1,1,1,1,0,0,1,1,N/A,1,1,0,1,1,0,1,11,
https://www.youtube.com/watch?v=zD9aXZY0pdY,Angina pectoris (stable; unstable; prinzmetal; vasospastic) - symptoms & pathology,368,1,0,1,1,1,1,1,1,0,1,1,1,1,1,1,1,14,
https://www.youtube.com/watch?v=MOH33-jFOwo,A1C Levels,369,1,1,1,1,0,0,1,1,0,0,0,0,1,1,0,1,9,
https://www.youtube.com/watch?v=2KnD9MzCzsM,Kidney Disease and Kidney Failure : 10 Early Signs and Symptoms That You May Have Kidney Disease,371,0,1,1,1,1,0,0,1,1,N/A,1,1,0,1,1,0,10,
https://www.youtube.com/watch?v=LuJd0z1JAU4,Gas gangrene,371,0,0,0,0,0,0,1,1,N/A,N/A,N/A,N/A,0,0,0,0,2,
https://www.youtube.com/watch?v=_cu7Xt4wb1M,Glucose Tolerance Test Procedure; Side Effects & Results,373,0,1,0,0,0,0,1,1,N/A,N/A,N/A,N/A,1,1,0,0,5,
